Sheet: 工作表1
A1: 李子园
A2: 自动舒适 | D2: 自动豪华 | H2: 自动豪华
A3: 指导价 | B3: 154900 | D3: 指导价 | E3: 165900 | H3: 指导价 | I3: 165900
A4: 优惠 | B4: 23000 | D4: 优惠 | E4: 23000 | H4: 优惠 | I4: 25900
A5: 祼车价 | B5: =R[-2]C-R[-1]C -> 131900 | D5: 祼车价 | E5: =R[-2]C-R[-1]C -> 142900 | H5: 祼车价 | I5: =R[-2]C-R[-1]C -> 140000
A6: 购置税 | B6: =R[-1]C/(1+17%) * (7.5%) -> 8455.1282051282051 | D6: 购置税 | E6: =R[-1]C/(1+17%) * (7.5%) -> 9160.2564102564102 | H6: 购置税 | I6: =R[-1]C/(1+17%) * (7.5%) -> 8974.3589743589746
A7: 服务费 | B7: 5000 | D7: 服务费 | E7: 5000 | H7: 服务费 | I7: 5000
A8: 贷款手续费 | B8: 1000 | D8: 贷款手续费 | E8: 1000 | H8: 贷款手续费 | I8: 1000
A9: 保险 | B9: 5800 | D9: 保险 | E9: 5800 | H9: 保险 | I9: 5800
B10: =SUM(R[-5]C:R[-1]C) -> 152155.12820512822 | E10: =SUM(R[-5]C:R[-1]C) -> 163860.25641025641 | I10: =SUM(R[-5]C:R[-1]C) -> 160774.35897435897
A11: 贴模+3次保养 | B11: 1800 | C11: 否则：送3桶油
A13: 武威路
A14: 自动舒适 | D14: 自动豪华 | H14: 自动豪华
A15: 指导价 | B15: 154900 | D15: 指导价 | E15: 165900 | H15: 指导价 | I15: 165900
A16: 优惠 | B16: 22500 | D16: 优惠 | E16: 22500 | H16: 优惠 | I16: 24000
A17: 祼车价 | B17: =R[-2]C-R[-1]C -> 132400 | D17: 祼车价 | E17: =R[-2]C-R[-1]C -> 143400 | H17: 祼车价 | I17: =R[-2]C-R[-1]C -> 141900
A18: 购置税 | B18: =R[-1]C/(1+17%) * (7.5%) -> 8487.1794871794882 | D18: 购置税 | E18: =R[-1]C/(1+17%) * (7.5%) -> 9192.3076923076933 | H18: 购置税 | I18: =R[-1]C/(1+17%) * (7.5%) -> 9096.1538461538476
A19: 服务费 | B19: 5000 | D19: 服务费 | E19: 5000 | H19: 服务费 | I19: 5000
A20: 贷款手续费 | B20: 1000 | D20: 贷款手续费 | E20: 1000 | H20: 贷款手续费 | I20: 1000
A21: 保险 | B21: 5800 | D21: 保险 | E21: 5800 | H21: 保险 | I21: 5800
B22: =SUM(R[-5]C:R[-1]C) -> 152687.1794871795 | E22: =SUM(R[-5]C:R[-1]C) -> 164392.30769230769 | I22: =SUM(R[-5]C:R[-1]C) -> 162796.15384615384
A23: 3M贴模+3次保养 | B23: 1800 | C23: 否则：送3桶油
A24: 行车记录仪送 | B24: 0
B27: =100000/24 -> 4166.666666666667
A29: 御桥路
A30: 自动豪华
A31: 指导价 | B31: 165900
A32: 优惠 | B32: 24000
A33: 祼车价 | B33: =R[-2]C-R[-1]C -> 141900
A34: 购置税 | B34: =R[-1]C/(1+17%) * (7.5%) -> 9096.1538461538476
A35: 服务费 | B35: 5000
A36: 贷款手续费 | B36: 1000
A37: 保险 | B37: 11600
B38: =SUM(R[-5]C:R[-1]C) -> 168596.15384615384
A41: 标的ID | B41: 标的名称
A42: ${projectId} | B42: ${projectName}
A46: 投资ID | B46: 投资金额 | C46: 投资人名称
A47: ${invest.id} | B47: ${invest.amount} | C47: ${invest.name}